{
  "at": "2026-09-25T18:35:28.447053+00:00",
  "batch": 1,
  "candidate_digest": "8d8f286b8ae2076739b830e7b45791ffe7f09853294561ab7591a049c00adf42",
  "checks": [
    {
      "evidence": [
        "runtime/v6/reviews/V6_compile_297e4d54680b970deaed/1/module-receipt.review.json"
      ],
      "id": "module_receipt",
      "status": "PASS"
    },
    {
      "evidence": [
        "runtime/v6/reviews/V6_compile_297e4d54680b970deaed/1/native-validator.review.json"
      ],
      "id": "native_validator",
      "status": "PASS"
    },
    {
      "evidence": [
        "runtime/v6/reviews/V6_compile_297e4d54680b970deaed/1/compile-manifest.review.json"
      ],
      "id": "compile_manifest",
      "status": "PASS"
    },
    {
      "evidence": [
        "runtime/v6/reviews/V6_compile_297e4d54680b970deaed/1/handoff.review.json"
      ],
      "id": "handoff",
      "status": "PASS"
    }
  ],
  "failure_owner": null,
  "reviewer_agent_id": "/root/host_bridge/v6_0f15f884265f9b6cd39021f7",
  "reviewer_dispatch_id": "review-67cb241c69480b658d6ac806",
  "schema": "review-record/6.0",
  "task_id": "V6_compile_297e4d54680b970deaed"
}
