{
  "schema": "review-record/6.0",
  "task_id": "TASK_bf0865334b4a88be570a164a",
  "batch": 2,
  "reviewer_agent_id": "/root/host_bridge/full_rehearsal/v6_9c8946265ae15cff1637e477",
  "reviewer_dispatch_id": "review-042e3afd47ec05dfe055ac2b",
  "candidate_digest": "612b97db7cca3cf006ab05777c6322fe31156a056f3d9e1a2d742b8669a36f89",
  "checks": [
    {
      "id": "module_receipt",
      "status": "PASS",
      "evidence": [
        "runtime/v6/reviews/TASK_bf0865334b4a88be570a164a/2/module-receipt.review.json"
      ]
    },
    {
      "id": "native_validator",
      "status": "PASS",
      "evidence": [
        "runtime/v6/reviews/TASK_bf0865334b4a88be570a164a/2/native-validator.review.json",
        "runtime/v6/reviews/TASK_bf0865334b4a88be570a164a/2/native-validator.raw.json"
      ]
    },
    {
      "id": "handoff",
      "status": "PASS",
      "evidence": [
        "runtime/v6/reviews/TASK_bf0865334b4a88be570a164a/2/handoff.review.json"
      ]
    }
  ],
  "failure_owner": null,
  "at": "2026-09-25T14:46:07.794165Z"
}
